id,title,title_display,parent_id,change notes,weight,encyc_links,description,created,modified
53,Responses of non-Japanese Americans [53],Responses of non-Japanese Americans,48,,,,"The reactions of non-Japanese friends, neighbors and classmates were mixed. Some turned their heads and refused to recognize their former friends. Others believed the government propaganda and became outright hostile. Still others helped their Japanese American neighbors by storing belongings and driving them to the places where they were to be picked up. Perhaps only a handful of people understood the true implications of the course of events.",2014-02-18T17:06:20-0800,2014-02-18T17:06:20-0800
54,Non-incarcerated Japanese Americans [54],Non-incarcerated Japanese Americans,399,,,,"A small percentage of Japanese Americans were not incarcerated during World War II: those who lived or worked outside the West Coast exclusion area and those who participated in ""voluntary evacuation."" During the war years, many of the non-incarcerated Japanese Americans faced hardship and discrimination, and were viewed with suspicion and even hostility by the greater public.",2014-02-18T17:06:20-0800,2014-02-18T17:06:20-0800
56,"""Voluntary evacuation"" [56]","""Voluntary evacuation""",54,,,,"For a three-week period during World War II, after Japanese Americans had been excluded from the West Coast but before plans for concentration camps had been finalized, a period of ""voluntary evacuation"" took place. Government officials hoped that the Japanese Americans barred from keeping their homes on the West Coast would make arrangements to move inland on their own, saving valuable military resources. However, state government officials and residents of neighboring states reacted with outrage that Japanese Americans were being encouraged to move there. Most Japanese Americans feared moving into such hostile territory where they would know no one. Further, few Japanese Americans had the resources to move their families to a new place. In total, 4,889 Japanese Americans left the West Coast ""voluntarily"" and moved to the interior of the U.S. during that period.",2014-02-18T17:06:20-0800,2014-02-18T17:06:20-0800
57,"Mass removal (""evacuation"") [57]","Mass removal (""evacuation"")",399,,,,"On March 2, 1942, Public Proclamation No. 1 began to appear on telephone poles and buildings. This was the first official notice Japanese Americans had of their immediate removal from the West Coast. The notices stated that they had six or seven days to prepare, and were to take only what they could carry. They were not told where they would be taken. People rushed to sell or store, in one week, property and belongings acquired over a lifetime. Some families tucked their valuables away in their attic or basement and locked the door, hoping to return soon. On the appointed ""evacuation"" day, thousands of Japanese Americans gathered at designated locations, with the numbered identification tags they had been issued tied to their coats. Watched by curious onlookers, they were met by armed soldiers and transported in buses, private cars, and trains to sixteen temporary ""assembly centers"" in California, Washington, Oregon and Arizona.",2014-02-18T17:06:20-0800,2014-02-18T17:06:20-0800
59,Economic losses [59],Economic losses,399,,,,"The economic and emotional toll associated with the uprooting of Japanese Americans from their homes and businesses was enormous. The cost was especially high for the issei (first-generation immigrants), who had worked most of their lives to establish financial security for themselves and their children. Many Japanese Americans bitterly recall being forced to sell property, personal belongings, and business equipment for a fraction of their value to opportunistic scavengers. Evacuees could take only what they could carry. They left behind heirlooms, cherished toys, and family pets. Farmers continued to work for a harvest they would never see, told it would be ""disloyal"" to stop. The bustling Nihonmachis (Japantowns) of the West Coast closed down and never fully recovered, even after the war ended.",2014-02-18T17:06:20-0800,2014-02-18T17:06:20-0800
61,Temporary Assembly Centers [61],Temporary Assembly Centers,399,,,,"In spring 1942, the Wartime Civil Control Administration (WCCA) hastily prepared temporary ""assembly centers"" to house the individuals of Japanese ancestry who were removed from their homes after the signing of Executive Order 9066. The centers were surrounded by barbed-wire fences and patrolled by armed military police. People were housed in animal stalls and barracks with communal bathrooms and mess halls. After spending up to six months in the ""assembly centers,"" Japanese Americans were moved inland to permanent concentration camps.",2014-02-18T17:06:20-0800,2014-02-18T17:06:20-0800
62,Living conditions [62],Living conditions,61,,,,"The ""assembly centers"" were hastily erected quarters located throughout the West Coast at fairgrounds, racetracks and other similar facilities. Conditions at these locations were appalling. People were housed in animal stalls and barracks with communal bathrooms and mess halls. Privacy was next to nonexistent. Most families lived in a 20-by-20-foot room separated from the next ""apartment"" by wood partitions that did not reach the ceiling. Shortages of food and deplorable sanitation were common. Overcrowding, uncertainty, and stress created tension in the ""assembly centers,"" even as the demoralized camp inmates tried to improve living conditions.",2014-02-18T17:06:20-0800,2014-02-18T17:06:20-0800
63,Social and recreational activities [63],Social and recreational activities,61,,,,"Despite deplorable living conditions at the ""assembly centers,"" camp inmates tried to make the best of it by organizing various social and recreational activities. Japanese Americans participated in dances and musical groups; sports and gardening were also popular.",2014-02-18T17:06:20-0800,2014-02-18T17:06:20-0800
65,Concentration camps [65],Concentration camps,399,,,,"The War Relocation Authority (WRA) oversaw construction of ten concentration camps in sparsely populated and isolated areas. Between June and October 1942, Japanese Americans were transferred from the ""assembly centers"" to the larger camps. Housing approximately 120,000 people, the camps were designed to be self-contained communities, complete with hospitals, post offices, schools, warehouses, and residential areas. The WRA attempted to establish normalcy by setting up newspapers, a degree of self-government, sports leagues, and social events. But confinement, monotony, and harsh conditions exacerbated tensions between pro- and anti-camp administration residents and between the disempowered Issei and their U.S.-born Nisei children. At several centers, conflicts erupted into violence and at the Manzanar concentration camp the unrest resulted in fatal shootings. The WRA gradually granted work and school leave to those they considered ""loyal."" The last camp closed in March 1946.",2014-02-18T17:06:20-0800,2014-02-18T17:06:20-0800
66,The journey [66],The journey,65,,,,"The journey from temporary ""assembly centers"" to permanent concentration camps was a difficult and disorienting experience. Japanese Americans were transported in buses and trains to desolate regions of the country guarded by armed soldiers. Forced to keep the window shades drawn, camp inmates were unaware of where they were going, and were often shocked by the harsh landscape upon arrival.",2014-02-18T17:06:20-0800,2014-02-18T17:06:20-0800
67,Living conditions [67],Living conditions,65,,,,"All of the camps were constructed according to the War Department's specifications, which included barbed-wire fences, guard towers, and armed guards around the perimeter. The camps were organized in ""blocks"" consisting of twelve to fourteen barracks, a mess hall, communal showers and toilets, laundry facilities, and a recreation hall. Each barracks was divided into four or six rooms with each room housing one family, no matter how large, and there was no running water. The furnishings that Japanese Americans found on their arrival were canvas cots, a potbellied stove, and a single bare light bulb. The thin walls offered little protection from the harsh weather, which ranged from 110 degrees in the summer to 25 degrees below zero on winter nights. The flimsy construction allowed no privacy and made normal family life difficult. Camp inmates improved their own living conditions by creating interior walls and partitions, constructing furniture from scrap lumber, and planting gardens.",2014-02-18T17:06:20-0800,2014-02-18T17:06:20-0800
68,Food [68],Food,65,,,,"The eating facilities in the camps were large mess halls with long lines and crowded tables. Group living tended to erode family solidarity, as teenagers escaped parental authority by eating with friends rather than family. The quality of the food was poor and milk and fresh meat were constantly in short supply. Inexpensive foods such as wieners, dried fish, pancakes, macaroni and pickled vegetables were served often. The diets of the camp inmates improved only after they began growing some of their own food.",2014-02-18T17:06:20-0800,2014-02-18T17:06:20-0800
69,"Facilities, services and camp administration [69]","Facilities, services, and camp administration",65,,,,,2014-02-18T17:06:20-0800,2014-02-18T17:06:20-0800
70,Medical care and health issues [70],Medical care and health issues,65,,,,"Medical and dental facilities were for the most part inadequate, lacking in both equipment and staff. Doctors and nurses were overworked, and treatment was often substandard as well as delayed. Camp inmates recall outbreaks of food poisoning, tuberculosis and dysentery epidemics, and preventable deaths of patients and newborns.",2014-02-18T17:06:20-0800,2014-02-18T17:06:20-0800
71,Holidays and festivals [71],Holidays and festivals,65,,,,"Striving to maintain normal lives, Japanese Americans held holiday celebrations and festivals inside the concentration camps. Whether decorating mess halls during the Christmas holiday as part of a camp-wide competition or participating in parades to celebrate the harvest of crops from their own gardens, the Japanese Americans demonstrated their resourcefulness and resilience.",2014-02-18T17:06:20-0800,2014-02-18T17:06:20-0800
72,Sports [72],Sports,65,,,,"Sports were a major form of recreation for the Issei and Nisei in the camps. Baseball became the preferred sport for both, although basketball and football were also popular among the Nisei. Organized teams, often consisting of friends from prewar neighborhoods, played each other in highly competitive matches. Other sports, like ping-pong, judo, boxing, badminton, and sumo wrestling were also popular pastimes.",2014-02-18T17:06:20-0800,2014-02-18T17:06:20-0800
73,Education [73],Education,65,,,,"Schools were quickly organized in the concentration camps, but they suffered from crude facilities and lack of teaching materials. Instruction was given for nursery through high school, and adult education was offered. Trained teachers were in short supply, however, and uncertified Japanese Americans with college degrees often filled in. The War Relocation Authority (WRA) deliberately emphasized Americanization in the education program. Some found it painfully ironic to watch incarcerated youth recite the Pledge of Allegiance.",2014-02-18T17:06:20-0800,2014-02-18T17:06:20-0800
74,Publications [74],Publications,65,,,,"From 1942-1945, camp inmates published newspapers documenting events inside and outside the camps. Although published under the direction of the camp administration, these newspapers were important for building and maintaining a sense of community among the Japanese Americans.",2014-02-18T17:06:20-0800,2014-02-18T17:06:20-0800
75,Religion [75],Religion,65,,,,"Japanese Americans used religion as one way to handle the stress of the incarceration experience. Church served as both a spiritual comfort and a place for community gatherings. On Sundays, Buddhist and Christian services and Sunday schools were held in the recreation halls. State Shintoism was another popular religion within the Japanese American community but was banned by the U.S. government on the grounds that it included ""Emperor worship."" Church services initially were given in both Japanese and English, but camp authorities later banned the use of Japanese at all group gatherings (although translation into Japanese was later permitted at some religious services).",2014-02-18T17:06:20-0800,2014-02-18T17:06:20-0800
76,Work and jobs [76],Work and jobs,65,,,,"Both Issei and Nisei took jobs within the camps, at wages set not to exceed soldiers' pay: $12 per month for unskilled labor, $16 for skilled labor, and $19 for professional employees. WRA staff was paid much more for the same jobs. Though public opinion mandated such low pay, dissatisfied Japanese Americans objected to losing their right to make a decent living. They had to use their sparse income for necessities, such as warm clothing and shoes.",2014-02-18T17:06:20-0800,2014-02-18T17:06:20-0800
78,Impact of incarceration [78],Impact of incarceration,65,,,,,2014-02-18T17:06:20-0800,2014-02-18T17:06:20-0800
80,Support from the non-Japanese American community [80],Support from the non-Japanese American community,399,,,,"During mass removal and incarceration, Japanese Americans received outside support and assistance from religious organizations, civil rights groups, and other concerned individuals. The American Friends Service Committee was one of the most active groups to help the Japanese American community during World War II. Committee members donated educational materials to the camp schools and libraries and were influential in persuading the government to allow Nisei to leave the camps for colleges in the interior of the country. Ministers, peace activists and other supporters of the Japanese American community often visited the camps and spoke out publicly against the incarceration. Church groups across the country also organized clothing and food drives for the camp inmates.",2014-02-18T17:06:20-0800,2014-02-18T17:06:20-0800
81,Camp pilgrimages [81],Camp pilgrimages,118,,,,"Annual pilgrimages to the sites of former camps have become important events in the Japanese American community. They are an opportunity for former camp inmates to visit places that dramatically affected their lives, as well as a way for younger generations to learn the history of the Japanese American incarceration. Often the pilgrimages last for a few days and include workshops, tours of the former campsites, and memorial services to honor those who died while incarcerated.",2014-02-18T17:06:20-0800,2014-02-18T17:06:20-0800
82,Department of Justice camps [82],Department of Justice camps,399,,,,"More than 5,500 Japanese immigrants (Issei) were arrested by the FBI following the attack on Pearl Harbor. Most were sent first to temporary Immigration and Naturalization Service (INS) detention stations and then transferred to Department of Justice (DOJ) internment camps, where they waited to appear before the Alien Enemy Hearing Board. These hearings determined whether the Issei would remain in the internment camps or be ""released"" to the War Relocation Authority (WRA) concentration camps. After the hearings, most of the Issei were sent to U.S. Army internment camps. The U.S. Army, charged with detaining military prisoners of war (POWs), then returned the Issei internees to DOJ control. The DOJ camps also interned Italian and German nationals and Japanese Latin Americans. Most of the DOJ internment camps held only men who had been separated from their families, but three camps housed single women and families. The camps were run by the INS, part of the Department of Justice.",2014-02-18T17:06:20-0800,2014-02-18T17:06:20-0800
84,"""Enemy alien"" classification [84]","""Enemy alien"" classification",399,,,,,2014-02-18T17:06:20-0800,2014-02-18T17:06:20-0800
85,"Registration and ""loyalty questionnaire"" [85]","Registration and the ""loyalty questionnaire""",401,,,,"To help administer the military draft and work release program, the U.S. Army and the War Relocation Authority (WRA) produced ""loyalty questionnaires"" for all Japanese Americans seventeen years of age and older. The questionnaires contained two questions that caused confusion and controversy. Despite serious problems with the wording and meaning of the questions, government officials and others generally considered those who answered ""no"" to these two questions to be ""disloyal"" to the United States, and they were transferred to the Tule Lake concentration camp which was designated a segregation camp. ""Yes"" answers to these questions made Japanese Americans eligible for service in the U.S. Army, and some became eligible for release and resettlement in areas outside of the West Coast exclusion zones.",2014-02-18T17:06:20-0800,2014-02-18T17:06:20-0800
86,Segregation and Tule Lake [86],Segregation and Tule Lake ,94,,,,"In July 1943, Tule Lake concentration camp was designated as a segregation center for those the camp authorities considered ""disloyal"" as a result of their answers on the mandatory ""loyalty questionnaire."" In September 1943, ""loyal"" Japanese Americans from Tule Lake began departing for other camps and ""disloyal"" Japanese Americans from other camps started arriving at Tule Lake. The number of guards increased from a few hundred to 930 and an eight-foot high double fence was erected. The camp's capacity was 15,000 but the peak population reached 18,789 as 6,249 original ""loyal"" Japaense Americans chose to stay rather than be uprooted again.",2014-02-18T17:06:20-0800,2014-02-18T17:06:20-0800
87,Renunciation of citizenship [87],Renunciation of citizenship,94,,,,"During World War II, 5,589 American citizens of Japanese descent renounced their U.S. citizenship. The renunciations took place between December 1944 and July 1945, mostly in Tule Lake concentration camp, California. The vast majority of renunciations had little to do with ""disloyalty"" to the U.S., but instead were the result of a series of complex conditions and events that were beyond the control of those involved. After a legal battle, most renunciants had their U.S. citizenship restored in the 1960s.",2014-02-18T17:06:20-0800,2014-02-18T17:06:20-0800
88,Military service [88],Military service,399,,,,The story of Japanese Americans in the military during World War II is complex and in many ways ironic. It is a story of mistrust by the very country for which these soldiers placed themselves in harms' way. Many were drafted directly out of the camps and fought for democracy abroad while their parents and families were incarcerated by their own government.,2014-02-18T17:06:20-0800,2014-02-18T17:06:20-0800
89,442nd Regimental Combat Team [89],442nd Regimental Combat Team ,88,,,,"The 100th Infantry Battalion began as part of the Hawaii National Guard. On June 5, 1942, 1,432 men left Hawaii for training at Camp McCoy, Wisconsin, and later at Camp Shelby, Mississippi. The 100th shipped out to North Africa on August 23, 1943, and saw heavy action in Italy. Because of its heavy casualties and many honors, the 100th became known as the ""Purple Heart Battalion."" The 442nd Regimental Combat Team was initially formed in 1943 from Japanese American volunteers from Hawaii and the mainland. Perhaps not surprisingly, only about 1,250 Japanese Americans volunteered from the concentration camps. In Hawaii, where there was no mass removal, almost 10,000 volunteered. The 442nd arrived in Italy in June 1944 where the battle-tested 100th Infantry Battalion became its 1st Battalion. In seven major campaigns, the 442nd became the most decorated unit for its size and length of service; the unit suffered 9,476 casualties, more than 300 percent of its original strength.",2014-02-18T17:06:20-0800,2014-02-18T17:06:20-0800
90,522nd Field Artillery Battalion [90],522nd Field Artillery Battalion,88,,,,"The 522nd Field Artillery Battalion of the 442nd Regimental Combat Team was known for its outstanding firing speed and accuracy. Many of the 522nd Field Artillery Battalion men had backgrounds in science and engineering. They needed strong mathematical skills to calculate target distance, gun range, gun angle, and powder strength. In 1945, the 522nd was sent separately to Germany to pursue the hastily retreating German troops. They unknowingly stumbled into the sub-camps of the infamous Dachau death camp and helped to free survivors.",2014-02-18T17:06:20-0800,2014-02-18T17:06:20-0800
91,Military Intelligence Service [91],Military Intelligence Service ,88,,,,"The first Japanese Americans to serve in the military during World War II were linguists involved in the Military Intelligence Service Language School (MISLS). The MISLS was charged with training soldiers in the Japanese language for intelligence purposes. Japanese Americans served as both instructors and students at the school, which opened on November 1, 1941. The Language School began recruiting instructors and later students directly from concentration camps as early as July 1942. MISLS graduates were assigned in small teams to units fighting in the Pacific and to intelligence centers throughout the Allied command. They translated captured documents, interrogated prisoners of war, wrote propaganda, encouraged Japanese soldiers and civilians to surrender, and monitored radio broadcasts. After the war, they acted as interpreters at the war crime trials and for the occupation government in Japan.",2014-02-18T17:06:20-0800,2014-02-18T17:06:20-0800
92,Pre-World War II service [92],Pre-World War II service,296,,,,"Prior to the attack on Pearl Harbor, approximately 5,000 Japanese Americans were already in the U.S. Army, most having been drafted. When war broke out, some Nisei soldiers were discharged, while others were placed in noncombat positions at Camp Robinson, Arkansas. Still others were overlooked by the military bureaucracy and continued in their positions. During this chaotic time, all other Nisei were reclassified 4-C, the status of ""enemy alien,"" and therefore became ineligible for the draft.",2014-02-18T17:06:20-0800,2014-02-18T17:06:20-0800
93,U.S. Counterintelligence Corps [93],U.S. Counterintelligence Corps,88,,,,"The first all-Nisei Counterintelligence Corps (CIC) unit began training at Camp Ritchie, Maryland, in the spring of 1945 to prepare for the occupation of Japan. The mission of the Nisei in CIC was to use their linguistic and cultural knowledge to detect and prevent activities directed against Occupation Forces. Nisei CIC personnel were assigned to every prefecture in Japan and relied on a network of police, local government officials and media to carry out their intelligence work. They were also involved with recruiting informants within nationalist and ultra-leftist organizations.",2014-02-18T17:06:20-0800,2014-02-18T17:06:20-0800
94,Resistance and dissidence [94],Resistance and dissidence,399,,,,"Resistance to exclusion and incarceration took many different forms: non-compliance with exclusion orders and concomitant court cases challenging them, refusal to obey draft orders, labor strikes, and individual and group protests within the camps.",2014-02-18T17:06:20-0800,2014-02-18T17:06:20-0800
95,Draft resistance [95],Draft resistance,94,,,,"In 1944 the government reinstated the draft for Japanese Americans after suspending it in 1942 and began drafting men directly from the camps. This action angered many. At Heart Mountain concentration camp, Wyoming, resistance took the form of an organized movement calling itself the Fair Play Committee. Members demanded that their rights as citizens be restored before enlisting in the military. Eventually, sixty-three men from Heart Mountain refused induction and were sentenced to prison terms for draft evasion. In the other camps, disparate individuals made the decision to resist the draft. After being unfairly incarcerated for almost two years, they saw the draft as the final injustice. Ultimately, 267 men from all the concentration camps were convicted of evading the draft and most served time in prison. President Truman pardoned all of the resisters in 1947.",2014-02-18T17:06:20-0800,2014-02-18T17:06:20-0800
96,Supreme Court cases [96],Supreme Court cases,94,,,,"Three Japanese Americans -- Gordon Hirabayashi, Fred Korematsu and Minoru Yasui -- refused to comply with exclusion and were subsequently arrested. Together, these resisters and their court cases tested two distinct yet intertwined constitutional issues: the legality of military orders on civilians (curfew, in particular), especially as they were selectively applied on the basis of race, and the legality of exclusion, again selectively applied on the basis of race. In all three cases the litigants lost at the trial court level and appealed to the Supreme Court. The Court ultimately upheld the three men's convictions and ruled that curfew orders and exclusion were constitutional.",2014-02-18T17:06:20-0800,2014-02-18T17:06:20-0800
