id,title,title_display,parent_id,change notes,weight,encyc_links,description,created,modified
97,Gordon Hirabayashi [97],Gordon Hirabayashi,96,,,,"Gordon Hirabayashi, a 24-year-old senior at the University of Washington, arrived at the FBI office in Seattle on May 16, 1942, the date that he had been ordered to register for exclusion. He handed the FBI agent a four-page statement that explained why he refused to register. Hirabayashi was raised as a Quaker and trained as a pacifist, and his reasons for refusal stemmed from his religious convictions and pacifism. Hirabayashi was arrested and his case became an important test of the constitutionality of exclusion. In 1986, Hirabayashi's case was reopened and his convictions surrounding the incarceration were vacated by the Ninth Circuit Court of Appeals, arguing in part that, ""racial bias was the cornerstone of the internment orders.""",2014-02-18T17:06:20-0800,2014-02-18T17:06:20-0800
98,Other forms of resistance [98],Other forms of resistance,94,,,,,2014-02-18T17:06:20-0800,2014-02-18T17:06:20-0800
99,Community responses to resistance [99],Community responses to resistance,94,,,,"In December 1947, President Truman pardoned all wartime draft resisters, including Nisei from the concentration camps. The pardon removed the criminal convictions from the resisters' records. However, other Japanese Americans, including some U.S. Army veterans and leaders of the Japanese American Citizens League (JACL), continued to label resisters as disloyal, unpatriotic, cowardly ""draft dodgers."" Some Japanese Americans blamed the resisters for increasing the public's negative attitudes toward people of Japanese ancestry. These consequences affected many resisters for the rest of their lives. Despite an official JACL apology to the resisters in 2000, many Japanese American veterans' groups and others continue to harbor negative feelings toward the resisters. Legacies of the World War II ostracism of resisters contribute to ongoing division within Japanese American communities.",2014-02-18T17:06:20-0800,2014-02-18T17:06:20-0800
100,Impact of resistance on families [100],Impact of resistance on families,94,,,,,2014-02-18T17:06:20-0800,2014-02-18T17:06:20-0800
101,Leaving camp [101],Leaving camp,399,,,,,2014-02-18T17:06:20-0800,2014-02-18T17:06:20-0800
102,Student leave [102],Student leave,101,,,,"In 1942, a small number of Japanese Americans began to exit the camps through a student relocation program. The early student resettlement to colleges in Midwestern and eastern states was organized by a coalition of church leaders and educators led by the American Friends Service Committee. The coalition persuaded colleges and universities in the country's interior to accept Japanese American students. It also helped the Nisei obtain security clearance to leave camp (a complicated process) and find housing. Tuition costs were borne by the students and their families. Although many parents gave up what savings they had, nearly all the students still worked round the clock to support themselves and their studies. By the end of the war, 4,000 Nisei students had entered approximately 600 colleges.",2014-02-18T17:06:20-0800,2014-02-18T17:06:20-0800
103,Work leave [103],Work leave,101,,,,"During World War II, Japanese Americans were seen as a source of replacement labor for the farms in Utah, Idaho, and Montana. Starting in May 1942, camp inmates could obtain temporary leaves to work in agriculture, either returning to the camps every night or living on the farm for an extended period. In 1942 alone, some 10,000 Japanese Americans left the camps to perform this seasonal work. Their labor was vital to the agriculture industry and thus to the war effort.",2014-02-18T17:06:20-0800,2014-02-18T17:06:20-0800
104,"""Resettlement"" [104]","""Resettlement""",101,,,['http://encyclopedia.densho.org/Resettlement'],"""Resettlement"" was a term used by the War Relocation Authority (WRA) to refer to the migration of Japanese Americans from the camps in which they were incarcerated during World War II. Those who were allowed to leave the camps for ""resettlement"" could not return to the West Coast; they were told to move to the eastern and northern areas of the United States. The WRA strongly encouraged the departing Japanese Americans to become more ""American"" and blend in with the local white population. WRA officials distributed photographs and articles depicting happy families enjoying their new surroundings. In reality, the ""resettlement"" period was not without hardships for many Japanese Americans.",2014-02-18T17:06:20-0800,2014-02-18T17:06:20-0800
106,Returning home [106],Returning home,101,,,,"When the camps closed, Japanese Americans were handed $25 and put on trains headed for the places they had been forcibly removed from nearly four years earlier. Harassment was common -- many returning Japanese Americans were greeted with signs reading ""No Japs Allowed."" Other discovered their property had been vandalized or stolen. Homes and businesses that had been boarded up or left in the care of others were abandoned and stripped of furnishings and goods. For the majority, who did not have homes to return to, housing was the most serious problem. Housing discrimination was severe in many areas and persisted to varying degrees until the civil rights legislation of the 1960s. Former camp inmates with no other options moved into hostels and converted community institutions with conditions not much better than the camps they had just left. Although this period was stressful, it is remembered as a time when people came together to share what they had.",2014-02-18T17:06:20-0800,2014-02-18T17:06:20-0800
107,Expatriation/repatriation/deportation [107],Expatriation/repatriation/deportation,94,,,,"From 1943 to 1946, over 20,000 Japanese Americans applied to leave the United States for Japan in a process called ""repatriation"" (for Issei as non-citizens) or ""expatriation"" (for Nisei as citizens). Some Issei considered repatriation preferable to remaining in a country that had long discriminated against them. For Nisei, who had rarely been to Japan, expatriation meant renouncing their U.S. citizenship. Some were pressured to do so by family members or extremists; others were bitter about their mistreatment by the government. In total, only 4,724 ended up leaving for Japan directly from the camps and many eventually returned to the U.S. Nearly all Nisei who wanted to were able to regain their citizenship, although the process was long and difficult.",2014-02-18T17:06:20-0800,2014-02-18T17:06:20-0800
108,Japan [108],Japan ,0,,,,,2014-02-18T17:06:20-0800,2014-02-18T17:06:20-0800
109,Atomic bombings of Hiroshima and Nagasaki [109],Atomic bombings of Hiroshima and Nagasaki,399,,,,,2014-02-18T17:06:20-0800,2014-02-18T17:06:20-0800
110,Redress and reparations [110],Redress and reparations,0,,,,"In the late 1960s, Japanese Americans began to revisit the history of the exclusion and incarceration period in order to seek justice for their suffering and ensure that no such wrong would ever be committed again. Years of effort by community activists, politicians, academics, and other supporters culminated on August 10, 1988, with the signing of the Civil Liberties Act by President Ronald Reagan. This Act rescinded Executive Order 9066, and mandated an official apology from the federal government, monetary reparations payments to individuals excluded and incarcerated, and the creation of a federal fund for research and education about the incarceration.",2014-02-18T17:06:20-0800,2014-02-18T17:06:20-0800
111,Mobilizing and organizing the community [111],Mobilizing and organizing the community,110,,,,,2014-02-18T17:06:20-0800,2014-02-18T17:06:20-0800
113,Formation and work [113],Formation and work,392,,,,"The Commission on Wartime Relocation and Internment of Civilians (CWRIC) was created on July 30, 1980 by an act of Congress. Formed mainly to investigate matters surrounding the incarceration and to recommend appropriate remedies, the CWRIC had no power to correct grievances and was viewed as a ""copout"" by those fighting for more immediate redress. Still, hearings were conducted in 20 cities across the nation beginning in 1981, and in 1982 the CWRIC issued its report 'Personal Justice Denied.' It was an exhaustive work that combined the testimonies of former camp inmates given at the hearings and research conducted by a team led by Aiko Yoshinaga Herzig. Ultimately, the CWRIC recommended, among other things, $20,000 individual compensation to those incarcerated and a formal government apology. This recommendation would be the basis for the many redress bills that were to follow. *See the CWRIC collection under photos/documents for examples of the documents found by CWRIC researchers.",2014-02-18T17:06:20-0800,2014-02-18T17:06:20-0800
114,Hearings [114],Hearings,392,,,,"The Commission on Wartime Relocation and Internment of Civilians (CWRIC) was created on July 30, 1980, by an act of Congress. The CWRIC was formed mainly to investigate matters surrounding the incarceration and to recommend appropriate remedies. Hearings were conducted by the CWRIC in 20 cities across the nation beginning in 1981. Testimonies of former camp inmates given at these hearings -- along with exhaustive research -- provided the basis for the CWRIC report 'Personal Justice Denied.' These hearings were the turning point of the redress movement. Former opponents of redress were won over after the hearings. The often emotional testimony was also a catharsis for the Japanese American community, as many former incarceration camp survivors spoke of their experience in public for the first time.",2014-02-18T17:06:20-0800,2014-02-18T17:06:20-0800
115,Lobbying and implementation of findings and recommendations [115],Lobbying and implementation of findings and recommendations,392,,,,"In December 1982, the Commission on Wartime Relocation and Internment of Civilians (CWRIC) issued its report, 'Personal Justice Denied,' which recommended $20,000 individual compensation and a formal apology. The job of making the recommendations of the commission a reality, however, was daunting. Beyond the few sympathetic Japanese American congressmen and congresswomen, redress supporters had few Washington connections. In 1983, redress bills were introduced but went nowhere. Redress groups decided to shift their resources to lobbying. The strategy was to frame the issue in a consistent way with both conservatives and liberals. Others in the redress movement reached out to non-Japanese American organizations to widen the base of support. Years of hard work and dedication paid off in 1988 when President Reagan signed the Civil Liberties Act into law.",2014-02-18T17:06:20-0800,2014-02-18T17:06:20-0800
116,Impact of redress movement [116],Impact of redress movement,110,,,,,2014-02-18T17:06:20-0800,2014-02-18T17:06:20-0800
117,Receiving redress checks and apology [117],Receiving redress checks and apology ,110,,,,"In 1988, President Ronald Reagan signed into law the Civil Liberties Act, which, among other things, mandated an official apology from the government and monetary payments to Japanese Americans incarcerated during World War II. On October 9, 1990, more than two years after the passage of the bill, the first of the redress payments were made in a formal ceremony to elderly issei survivors in Washington, D.C. Similar ceremonies were held in cities across the country. While few of those who were incarcerated feel that the government's apology erases what was done, many believe that a formal admission of wrongdoing helped resolve feelings of shame and corrected misperceptions held by the larger society.",2014-02-18T17:06:20-0800,2014-02-18T17:06:20-0800
118,Reflections on the past [118],Reflections on the past,0,,,,,2014-02-18T17:06:20-0800,2014-02-18T17:06:20-0800
120,Activism and involvement [120],Activism and involvement,0,,,,,,
157,Fred Korematsu [157],Fred Korematsu,96,,,,"Fred Korematsu was a welder who lost his job after the attack on Pearl Harbor when the Boilermakers Union expelled all Japanese American members. Korematsu decided to resist the mass removal orders, and planned to leave the state. On May 30, 1942, Korematsu was arrested for violating the exclusion order after failing to report to Tanforan Assembly Center. When Korematsu was contacted by an ACLU lawyer looking for a test case, he decided to fight the evacuation order. Korematsu lost his Supreme Court case in 1944. In the early 1980s, his case was reopened after the discovery of a crucial document indicating that in the original 1944 case, the federal government had lied to the high court. The conviction was vacated by U.S. District Judge Marilyn Hall Patel in 1983.",2014-02-18T17:06:20-0800,2014-02-18T17:06:20-0800
158,Minoru Yasui [158],Minoru Yasui,96,,,,"On March 28, 1942, Minoru Yasui intentionally violated curfew orders in Portland, Oregon, and then walked into a police station, demanding to be arrested. A lawyer and U.S. Army reserve officer, Yasui had worked at the Japanese consulate in Chicago. After Pearl Harbor he had been pressed into active duty, but subsequently was rejected for formal induction because of his Japanese ancestry. Yasui made himself a test case because he objected to the military orders that violated his rights as a citizen. Yasui was ultimately convicted of violating the curfew.",2014-02-18T17:06:20-0800,2014-02-18T17:06:20-0800
160,Organized labor [160],Organized labor,5,,,,"Japanese immigrants, especially upon arrival, labored at menial jobs in the industries of agriculture, railroads, lumber, canneries, mining, and fishing. These workers toiled under poor, unsanitary, and often dangerous conditions for low wages. Around the turn of the century, sugar-beet harvesters earned about $1.25 for a ten-hour day, railroad workers earned between $1.00 and $1.25 per day, and Alaskan cannery workers earned between $100 and $200 for a six-month season. They actively sought to better their wages and living conditions through organizing unions and engaging in strikes, despite being barred from white unions.",2014-02-18T17:06:20-0800,2014-02-18T17:06:20-0800
161,Stereotypes [161],Stereotypes,36,,,,,2014-02-18T17:06:20-0800,2014-02-18T17:06:20-0800
162,"Conflicts, intimidation, and violence [162]","Conflicts, intimidation, and violence",65,,,,,2014-02-18T17:06:20-0800,2014-02-18T17:06:20-0800
163,Pre-World War II [163],Pre-World War II,108,,,,,2014-02-18T17:06:20-0800,2014-02-18T17:06:20-0800
164,During World War II [164],During World War II,108,,,,,2014-02-18T17:06:20-0800,2014-02-18T17:06:20-0800
165,Post-World War II [165],Post-World War II,108,,,,,2014-02-18T17:06:20-0800,2014-02-18T17:06:20-0800
166,Japanese Latin Americans [166],Japanese Latin Americans,0,,,,"During World War II, 2,264 Latin Americans of Japanese ancestry were forcibly deported from their countries of residence and taken to the U.S. where they were placed in internment camps in order to be exchanged for Americans held by Japanese forces. Some 80 percent of the internees were Japanese Peruvians; the rest came from various Pacific-facing countries from Mexico to Chile. At the conclusion of the war, most of the interned Japanese Latin Americans were forced to leave the U.S. However, since many were initially barred from returning to their home countries, more than 900 Japanese Latin Americans were deported to war-devastated Japan. Over 350 Japanese Latin Americans remained in the U.S. and fought deportation in the courts. Eventually, about 100 managed to gain reentry to their home countries in Latin America. It was not until 1952 that those who stayed were allowed to begin the process of becoming U.S. permanent residents. Many later became U.S. citizens.",2014-02-18T17:06:20-0800,2014-02-18T17:06:20-0800
167,Legal cases/coram nobis cases [167],Legal cases/coram nobis cases,110,,,,"Coram nobis cases refer to the 1980s attempt to reverse the World War II-era convictions of Gordon Hirabayashi, Fred Korematsu and Minoru Yasui, who challenged the constitutionality of the curfew and exclusion orders. The Supreme Court had upheld their convictions on the basis of military necessity. In the early 1980s, researcher Aiko Yoshinaga Herzig and legal historian Peter Irons discovered declassified documents verifying that the government had withheld information showing that there was no military necessity in the forced removal and incarceration of Japanese Americans. Soon after, legal teams were assembled and identical coram nobis petitions were filed in three separate federal district courts on behalf of Hirabayashi, Korematsu, and Yasui. All three wartime convictions were subsequently vacated.",2014-02-18T17:06:20-0800,2014-02-18T17:06:20-0800
168,Redress and reparations [168],Redress and reparations,166,,,,"On August 10, 1988, President Ronald Reagan signed into law the Civil Liberties Act, which, among other things, mandated an official apology from the government and monetary payments to Japanese Americans incarcerated during World War II. However, this redress excluded Japanese Latin Americans who were forcibly deported from their home countries and placed in U.S. internment camps. A class action lawsuit, 'Mochizuki v. U.S.A,' was filed in 1996 on behalf of all the Japanese Latin Americans denied redress. It resulted in a settlement agreement authorizing an official apology and $5,000 compensation payments, one-fourth of what was awarded to Japanese Americans. Some Japanese Latin Americans decided to reject the Mochizuki settlement offer and continue litigation in U.S. and International courts.",2014-02-18T17:06:20-0800,2014-02-18T17:06:20-0800
169,"September 11, 2001 and aftermath [169]","September 11, 2001 and aftermath",118,,,,,2014-02-18T17:06:20-0800,2014-02-18T17:06:20-0800
170,U.S. government propaganda [170],U.S. government propaganda,426,,,,,2014-02-18T17:06:20-0800,2014-02-18T17:06:20-0800
171,Arts and literature [171],Arts and literature,61,,,,,2014-02-18T17:06:20-0800,2014-02-18T17:06:20-0800
172,Arts and literature [172],Arts and literature,65,,,,,2014-02-18T17:06:20-0800,2014-02-18T17:06:20-0800
173,Minidoka Irrigator [173],Minidoka Irrigator,74,,,,"The Minidoka Irrigator was published from September 10, 1942 to July 28, 1945. The newspaper was staffed mainly by camp inmates who wrote the articles, set the type, and printed the final copies. The Irrigator offered advice on how to adapt to life in Minidoka and publicized camp activities, such as dances and sports events.",2014-02-18T17:06:20-0800,2014-02-18T17:06:20-0800
174,Tulean Dispatch [174],Tulean Dispatch,74,,,,"The Tulean Dispatch was published from June 15, 1942 to October 30, 1943. The newspaper was shut down after Tule Lake concentration camp was transformed into a segregation center.",2014-02-18T17:06:20-0800,2014-02-18T17:06:20-0800
175,Heart Mountain Sentinel [175],Heart Mountain Sentinel,74,,,,"The Heart Mountain Sentinel was published from October 24, 1942 to July 28, 1945. Bill Hosokawa, a renowned journalist and active Japanese American Citizens League member, was the founding editor of the Sentinel.",2014-02-18T17:06:20-0800,2014-02-18T17:06:20-0800
176,Naturalization [176],Naturalization,1,,,,"Unlike other immigrants to the United States, Japanese and other Asians were not permitted to become naturalized American citizens until 1952. Under existing laws, naturalization was limited to ""free white persons and to aliens of African nativity and to persons of African descent."" Despite many attempts by Japanese immigrants (Issei) to gain citizenship, they were usually rejected on the grounds that the Issei were neither white nor black. The 1922 Supreme Court case Ozawa v. U.S. cemented the status of the issei as ""aliens ineligible to citizenship"" once and for all. It wasn't until 1952 with the passage of the Immigration and Nationality Act that Issei were finally allowed to become naturalized U.S. citizens.",2014-02-18T17:06:20-0800,2014-02-18T17:06:20-0800
177,Discriminatory laws [177],Discriminatory laws,340,,,,,2014-02-18T17:06:20-0800,2014-02-18T17:06:20-0800
178,Anti-immigration sentiment [178],Anti-immigration sentiment,1,,,,,2014-02-18T17:06:20-0800,2014-02-18T17:06:20-0800
179,Recreational activities [179],Recreational activities,15,,,,Japanese American communities organized group social activities such as family picnics and outings to the beach or to parks when the demands of work allowed. These activities gave hardworking families the chance to spend leisure time with their friends and neighbors.,2014-02-18T17:06:20-0800,2014-02-18T17:06:20-0800
180,Visual arts [180],Visual arts,40,,,,,,
181,Literary arts [181],Literary arts,40,,1,,,2014-02-18T17:06:20-0800,2014-02-18T17:06:20-0800
183,Music [183],Music,247,,,,,,
185,"""Yellow Peril"" [185]","""Yellow Peril""",36,,,,"""Yellow peril"" was a term used by anti-Japanese movement agitators in the early 1900s to describe the ""threat"" of Japanese immigration as a precursor to a Japanese invasion of the United States. Among the many groups and individuals who propagated the ""yellow peril"" myth were William Randolph Hearst's newspapers, which convinced many Californians during the early 1900s that a Japanese invasion was imminent.",2014-02-18T17:06:20-0800,2014-02-18T17:06:20-0800
186,Violence [186],Violence,36,,,,,2014-02-18T17:06:20-0800,2014-02-18T17:06:20-0800
187,"""War hysteria"" [187]","""War hysteria""",48,,,,,2014-02-18T17:06:20-0800,2014-02-18T17:06:20-0800
188,Exclusion orders [188],Exclusion orders,57,,,,"On February 19, 1942, President Roosevelt signed Executive Order 9066, which allowed the military to exclude people from any location without a trial or hearing. While it did not name people of Japanese ancestry specifically, it was clearly aimed at them and was enforced accordingly. Under the authority of Executive Order 9066, General John DeWitt defined 108 exclusion areas throughout the West Coast, each containing approximately 1,000 Japanese Americans. The first exclusion orders were issued for Bainbridge Island, Washington on March 24, 1942. Orders were posted around town, informing all Japanese American residents of the impending mass removal. Individuals and families were given only one week to prepare. By the end of October 1942, all 108 exclusion orders had been issued, forcing over 110,000 Japanese Americans into concentration camps around the country.",2014-02-18T17:06:20-0800,2014-02-18T17:06:20-0800
189,Preparation [189],Preparation,57,,,,"On March 2, 1942, Public Proclamation No. 1 began to appear on telephone poles and buildings. This was the first official notice Japanese Americans had of their immediate removal from the West Coast. The notices stated that they had six or seven days to prepare, and were to take only what they could carry. They were not told where they would be taken. People rushed to sell or store, in one week, property and belongings acquired over a lifetime. Some families tucked their valuables away in their attic or basement and locked the door, hoping to return soon.",2014-02-18T17:06:20-0800,2014-02-18T17:06:20-0800
190,"""Evacuation Day"" [190]","""Evacuation Day""",57,,,,"On the appointed ""evacuation day,"" thousands of Japanese Americans gathered at designated locations, with the numbered identification tags they had been issued tied to their coats. Watched by curious onlookers, they were met by armed soldiers and transported in buses, private cars, and trains to sixteen temporary ""assembly centers"" in California, Washington, Oregon, and Arizona.",2014-02-18T17:06:20-0800,2014-02-18T17:06:20-0800
191,Aftermath [191],Aftermath,57,,,,"The ""evacuation"" of Japanese Americans from their homes on the West Coast reduced once-thriving communities to ghost towns. Having only a week to prepare for the removal, many Japanese Americans were forced to board up and abandon businesses and homes. Rampant anti-Japanese sentiment in newspapers, theater newsreels, and radio broadcasts fueled acts of vandalism against the vacated neighborhoods.",2014-02-18T17:06:20-0800,2014-02-18T17:06:20-0800
192,The journey [192],The journey,61,,,,"The journey to temporary ""assembly centers"" was a difficult and disorienting experience. After gathering at designated locations, Japanese Americans were met by armed soldiers and transported in buses, private cars, and trains to sixteen temporary ""assembly centers."" When they arrived at their new homes -- often hastily refurbished fairgrounds and racetracks -- they were shocked to see barbed-wire fences, guard towers, and searchlights.",2014-02-18T17:06:20-0800,2014-02-18T17:06:20-0800
193,Publications [193],Publications,61,,,,"Japanese Americans in the ""assembly centers"" produced and distributed newspapers, which provided information about activities and sports, living conditions, work leave, and the move to permanent concentration camps. These newspapers were an important source of information during an uncertain time.",2014-02-18T17:06:20-0800,2014-02-18T17:06:20-0800
194,North Portland Evacuazette [194],North Portland Evacuazette,193,,,,"The North Portland Evacuazette was the newspaper for the Portland Assembly  Center, California, which was open from May 2, 1942 to September 10, 1942. The newspaper provided information about activities and sports, living conditions, work leave, and the move to permanent camps.",2014-02-18T17:06:20-0800,2014-02-18T17:06:20-0800
