id,title,title_display,parent_id,change notes,weight,encyc_links,description,created,modified
1,Immigration and citizenship [1],Immigration and citizenship,0,,,,"Japanese immigrants began arriving in the United States at the end of the nineteenth century when workers were recruited to meet the growing need for low-wage laborers in the Territory of Hawaii and on the West Coast. Commodore Perry had opened Japan to American commerce and trade relations in 1853, but anti-Asian sentiment resulted in the Gentlemen's Agreement of 1907, which halted the immigration of workers from Japan. In 1910, the Japanese population was about 80,000 in Hawaii and 72,000 on the continental United States. Japanese women continued to enter the country until the 1924 Immigration Act cut off immigration from Japan to the United States. Most of the early Japanese immigrants, the Issei (first generation), came as contract agricultural laborers, although many others were students and merchants. While Japanese immigrants were prohibited by discriminatory laws from becoming naturalized citizens of the United States, their American-born children (nisei) held U.S. citizenship.",2014-02-18T17:06:20-0800,2014-02-18T17:06:20-0800
2,Life in Japan and reasons for leaving [2],Life in Japan and reasons for leaving,1,,,,"Most of the Issei (first-generation) immigrants belonged to the peasant farming class that had been hurt by industrialization, inflation, and rising taxes caused by the Meiji government's modernization program. The majority of the immigrant workers came from the four prefectures of Hiroshima, Yamaguchi, Kumamoto, and Fukuoka. The country was hard hit by depression following the Russo-Japanese war, which ended in 1905. Hoping for better economic opportunity than was available in the rigid society of Japan -- then just emerging from the feudal era -- ambitious men, especially younger sons who would not inherit property, traveled to the new country with the dream of making their fortune. Pioneer Issei women -- the first Japanese women to receive public education under Meiji reforms -- joined them as brides, many seeking to avoid living under the authority of their marital families.",2014-02-18T17:06:20-0800,2014-02-18T17:06:20-0800
3,The Journey [3],The Journey,1,,,,"The Issei (first-generation Japanese immigrants) crossed the Pacific in crowded steamships for the two-week journey to the West Coast of the United States. Thousands of immigrants left Japan from Yokohama Harbor outside Tokyo and entered the U.S. at Angel Island, the immigration station in San Francisco Bay. The immigrants were examined and inoculated for communicable diseases upon boarding and examined again upon arrival. Because it took time to obtain a visa and the necessary health clearances, the journey from one's hometown in Japan could extend up to a month.",2014-02-18T17:06:20-0800,2014-02-18T17:06:20-0800
4,Arrival [4],Arrival,1,,,,"Labor contractors transported workers from Japan to work on Hawaiian sugar plantations. Many Japanese then emigrated to the mainland and worked for lumber companies, railroads, and canneries. In the early 1900s these immigrants began to establish families through the picture bride system (shashin-kekkon, literally ""photograph marriage""). Immigrant bachelors sent photographs and information about themselves to go-betweens (baishakunin) who arranged meetings with the families in Japan. Marriage ceremonies took place in Japan (without bridegrooms), then the new brides traveled to the United States to join their husbands. Many arrived to discover that their husbands had misrepresented their appearances or situations.",2014-02-18T17:06:20-0800,2014-02-18T17:06:20-0800
5,Industry and employment [5],Industry and employment,0,,,,"At the turn of the century, Japanese immigrants (Issei) came to the United States to work on the rapidly expanding plantations of Hawaii and the farms, lumber mills, railroads and canneries of the Pacific Coast. They quickly realized this type of work was not going to bring them wealth, and many began looking for more promising opportunities. Farming, fishing and small businesses were often seen as the answer.",2014-02-18T17:06:20-0800,2014-02-18T17:06:20-0800
6,Agriculture [6],Agriculture,5,,,,"Many Issei (first-generation Japanese immigrants) began as sharecroppers. Others sought to buy land, but the Issei had to overcome obstacles preventing them from competing with white farmers. California and other states passed alien land laws prohibiting Asian immigrants from purchasing or leasing agricultural land. There were ways around the discriminatory laws: an Issei father could put the property in the name of his American-born child, or issei could form corporations in which a majority of the shareholders were American citizens. Despite the alien land laws, Issei farmers played a significant role in West Coast agriculture. In the years just prior to World War II, Japanese American families grew 35 percent of the produce in California. By the 1920s, Japanese Americans supplied 75 percent of the produce and half the milk to the Puget Sound region.",2014-02-18T17:06:20-0800,2014-02-18T17:06:20-0800
7,Farmers' markets and stands [7],Farmers' markets and stands,6,,,,"Farming cooperatives allowed growers to purchase equipment and supplies at lower cost as well as market their products more effectively. A Japanese grower could place his produce on consignment with a Japanese packer-shipper who would sell the produce to a Japanese fruit-stand operator. In areas where the Japanese were successful in agriculture, a burgeoning community of flower and produce vendors sprang up in the local marketplace. The farmers market in Seattle and other West Coast cities were heavily populated by Japanese Americans before World War II.",2014-02-18T17:06:20-0800,2014-02-18T17:06:20-0800
8,Small business [8],Small business,5,,,,"Japanese American businesses, such as groceries, fish shops, laundries, barbershops, public bathhouses, restaurants, drugstores, and dry goods stores, sprang up in communities along the West Coast. Women and children were vitally important to these ""mom and pop"" enterprises, as their free labor allowed the family to survive and even prosper during lean times.",2014-02-18T17:06:20-0800,2014-02-18T17:06:20-0800
9,Timber [9],Timber,5,,,,"Japanese immigrants (Issei) replaced Chinese workers after the 1882 Chinese Exclusion Act went into effect. Laborers were recruited by contracting companies to cut timber and work in sawmills. In rare instances, Issei women joined their husbands, living among the other workers in segregated shantytowns.",2014-02-18T17:06:20-0800,2014-02-18T17:06:20-0800
10,Fishing and canneries [10],Fishing and canneries,5,,,,"Japanese Americans found work at salmon canneries along the Columbia River in Oregon and Washington, and their labor was welcomed in Alaskan towns such as Ketchikan and Petersburg as early as the 1890s. They traveled by ship to the cannery towns, where they slowly developed small communities whose population swelled with the yearly arrival of workers. Issei (Japanese immigrant) entrepreneurs started the oyster industry from scratch in Puget Sound. Japanese American oyster farms became thriving businesses before World War II.",2014-02-18T17:06:20-0800,2014-02-18T17:06:20-0800
11,Railroads [11],Railroads,5,,,,"When the 1882 Chinese Exclusion Act ended the immigration of workers from China, railroad companies turned to the Japanese to fill the void. Labor contracting companies such as Furuya and Tobo recruited workers for the Northern Pacific and Great Northern railways. Issei (Japanese immigrant) men were primarily manual laborers, working ten-hour days laying tracks.",2014-02-18T17:06:20-0800,2014-02-18T17:06:20-0800
12,Hotel industry [12],Hotel industry,5,,,,"Many entrepreneurial Japanese families owned and operated hotels in Japantowns or Chinatowns. In Seattle, for instance, the ""skidroad"" neighborhood featured many Japanese-run hotels where single men of various races and backgrounds lived. The hotels provided housing as well as income for the families.",2014-02-18T17:06:20-0800,2014-02-18T17:06:20-0800
14,Domestic service [14],Domestic service,5,,,,"Before World War II, many newly arrived young Issei (Japanese immigrant) men and, later, Issei women worked as domestics. Wages were low -- about $1.50 per week in 1900 -- but room and board were provided, and living with an American family provided a means of quickly learning the English language and American customs. After the war, for want of better jobs, dispossessed older Issei and college-age Nisei (their American-born children) again took employment as domestics for well-to-do families.",2014-02-18T17:06:20-0800,2014-02-18T17:06:20-0800
15,Community activities [15],Community activities,0,,,,"Japanese Americans of the pre-World War II era, urban and rural dwellers alike, lived in tight-knit communities bound together by a wide variety of shared associations and institutions. In an era marked by pronounced anti-Asian racism, Japanese Americans in cities tended to live in segregated ghettoes. While discrimination was the reason for isolated Japanese American neighborhoods, the well-organized and tight-knit community provided a rich social and cultural foundation for the Japanese immigrants and their children.",2014-02-18T17:06:20-0800,2014-02-18T17:06:20-0800
16,Associations and organizations [16],Associations and organizations,15,,,,"The Issei (Japanese immigrants) established cultural, business, and religious organizations that supported ethnic enclaves. This early form of networking served more than social and economic interests -- it became a substitute for the extended-family and village systems left behind in Japan. Christian and Buddhist neighborhood churches, Japanese language schools, and sports leagues allowed the Nisei (second-generation Japanese Americans) to participate in organized social activities as well as form peer networks.",2014-02-18T17:06:20-0800,2014-02-18T17:06:20-0800
17,Kenjinkai [17],Kenjinkai,16,,,,"Kenjinkai were organizations made up of Issei (Japanese immigrants) who shared roots in the same prefecture (ken) in Japan. They fostered a sense of community for immigrants in a strange land by sponsoring social events such as dinners and picnics, serving as mutual aid societies, and providing informal networks for apprenticeships, hiring, and business patronage.",2014-02-18T17:06:20-0800,2014-02-18T17:06:20-0800
18,Economic associations [18],Economic associations,16,,,,"Since banks would not lend to Japanese immigrants, these enterprising Issei formed groups to pool their resources. For the tanomoshii system of credit, members would contribute monthly to a pooled account and take turns drawing funds to start or expand a business. The Japanese also formed farming cooperatives that helped growers purchase supplies and market their crops. Under this system, a Japanese grower placed his produce on consignment with a Japanese packer-shipper who would sell the produce to a Japanese fruit-stand operator.",2014-02-18T17:06:20-0800,2014-02-18T17:06:20-0800
19,Veterans' organizations [19],Veterans' organizations,296,,,,"Serving in the U.S. military during World War II despite the incarceration was a defining experience for many Nisei (second-generation Japanese American) men. Even as their members age, Nisei veterans' organizations continue to be active community groups.",2014-02-18T17:06:20-0800,2014-02-18T17:06:20-0800
20,The Japanese American Citizens League [20],The Japanese American Citizens League,16,,,,"The Japanese American Citizens League (JACL) was organized in the late 1920s by a small group of young, professional nisei in response to the anti-Japanese fervor of the times. The organization was decidedly patriotic and dealt with discrimination by emphasizing American citizenship, loyalty, and assimilation. Because of their ideology, JACL members were recruited by the military to assist in carrying out the ""evacuation"" orders, and they urged Japanese Americans to cooperate with the government. The group inspired strong, mixed feelings among Japanese Americans during this time. However, in the years following the war, the JACL regained much of its former support by successfully overturning many legal barriers for Japanese Americans.",2014-02-18T17:06:20-0800,2014-02-18T17:06:20-0800
21,Community and social service associations [21],Community and social service associations,16,,,,"After World War II, in areas where Japanese Americans resettled in large numbers, community and social service organizations were formed to meet their needs. In Seattle, for instance, Nisei (second-generation Japanese Americans) organized and raised funds for a retirement home that would be culturally appropriate for the Issei (first-generation immigrants). Further, some Japanese Americans chose to go into social service work, in part motivated by their wartime incarceration.",2014-02-18T17:06:20-0800,2014-02-18T17:06:20-0800
22,Student clubs [22],Student clubs,16,,,,"At West Coast universities before World War II, Japanese clubs were formed for students from Japan and Nisei (second-generation Japanese Americans) who were reaching college age. Because it was understood that people of Japanese ancestry would not be accepted at white fraternities, the solution was to form segregated clubs.",2014-02-18T17:06:20-0800,2014-02-18T17:06:20-0800
23,Boy Scouts and Girl Scouts of America [23],Boy Scouts and Girl Scouts of America,16,,,,"In the 1920s and 1930s, nisei (second-generation) boys joined Boy Scout troops organized by public schools or community churches. Promoting ""Americanism,"" government administrators condoned Boy Scout activities in the World War II concentration camps.",2014-02-18T17:06:20-0800,2014-02-18T17:06:20-0800
24,Sports [24],Sports,179,,,,"Sports leagues were important institutions for Japanese Americans growing up on the West Coast. Both boys and girls played basketball, baseball and other sports. The traditional Japanese martial arts of judo and kendo were practiced as well. Baseball became the primary sport for young Japanese Americans who were often prohibited from playing in the white leagues. The highly competitive games in the all-Japanese American leagues built pride and a sense of community.",2014-02-18T17:06:20-0800,2014-02-18T17:06:20-0800
25,"Festivals, celebrations, and holidays [25]","Festivals, celebrations, and holidays",15,,,,"Sources of Japanese American community interaction included picnics, musicals, concerts, martial arts competitions, and festivals such as Bon Odori (annual Buddhist festival commemorating ancestors).",2014-02-18T17:06:20-0800,2014-02-18T17:06:20-0800
26,Community publications [26],Community publications,387,,,,"The Japanese American press provided a vital sense of community. Numerous newspapers were published in cities and towns up and down the West Coast. Seattle alone boasted two Japanese-language dailies and an English-language weekly for the community. The Japanese American Courier, which appeared in Seattle in 1928, was the first English-language Japanese American newspaper in the nation.",2014-02-18T17:06:20-0800,2014-02-18T17:06:20-0800
27,"Nihonmachi (""Japantowns"") [27]","Nihonmachi (""Japantowns"")",15,,,,"Because of housing and employment discrimination, Japanese Americans tended to cluster in ethnic neighborhoods known as Nihonmachi, or ""Japantowns."" Living, working, studying, and worshiping in close proximity made for tight-knit communities. With the forced removal of Japanese Americans in the spring of 1942, the bustling Nihonmachis of the West Coast closed down and never fully recovered, even after the war ended.",2014-02-18T17:06:20-0800,2014-02-18T17:06:20-0800
28,Weddings [28],Weddings,179,,,,"The rituals of weddings and funerals, whether Christian or Buddhist, were community events. The ceremonies were often elaborate and blended Japanese and American customs. During the World War II incarceration, many Issei (first-generation immigrant) parents confined in the camps were notified that their sons had died in combat.",2014-02-18T17:06:20-0800,2014-02-18T17:06:20-0800
29,Religion and churches [29],Religion and churches,0,,,,"Religion and churches played an important role in the formation and development of West Coast Japanese American communities. While Buddhism is frequently seen as most prominent, Christianity was also influential. Initially focused on helping new male immigrants adjust to life in the United States, churches soon began catering to increasing numbers of families. By the mid-1930s, Japanese Americans' religious affiliations were split fairly evenly between Christianity and Buddhism.",2014-02-18T17:06:20-0800,2014-02-18T17:06:20-0800
31,Education [31],Education,0,,,,"Most of the Nisei (second-generation Japanese Americans) who grew up on the West Coast lived in relatively small sections of the city and shared common experiences in the public schools as well as Japanese language schools. The World War II incarceration interrupted thousands of students' elementary, high school and university educations.",2014-02-18T17:06:20-0800,2014-02-18T17:06:20-0800
32,Public schools [32],Public schools,31,,,,"Nisei (second-generation) children attended public schools alongside children of other races, although schools in Nihonmachi (Japantown) neighborhoods were overwhelmingly Japanese ethnically. Since Japanese was usually spoken at home, many Nisei learned to speak English in public school. In Seattle, people fondly remember the Bailey Gatzert elementary school whose white principal remained in touch with her students after they were taken to the camps. The Japanese Americans who would have graduated from high school and college in spring 1942 were removed to camps before they could complete the year and attend commencement.",2014-02-18T17:06:20-0800,2014-02-18T17:06:20-0800
33,Japanese language schools [33],Japanese language schools,31,,,,"Each day, after public school ended, Nisei (second-generation) children attended Japanese language schools for an hour's instruction in Japanese language and culture. Issei (first-generation) parents wanted their children to learn Japanese to help them succeed in the community and if they ever moved to Japan. The Nisei were moderately interested at best, and language acquisition was spotty. Japanese language schools were considered suspect after the attack on Pearl Harbor, and their principals were among the first arrested.",2014-02-18T17:06:20-0800,2014-02-18T17:06:20-0800
34,Higher education [34],Higher education,31,,,,"The Issei (first-generation Japanese immigrants) put great emphasis on education as a means of succeeding in the U.S. While many Nisei (second-generation Japanese Americans) obtained college degrees, they found professions closed to them. It was not uncommon for educated nisei to be forced to settle for menial jobs in the ethnic community. Frequently, Japanese Americans could find jobs commensurate with their education only by becoming independent professionals such as doctors and dentists providing services to the Japanese community. The World War II incarceration interrupted thousands of students' university educations.",2014-02-18T17:06:20-0800,2014-02-18T17:06:20-0800
35,Church-run schools [35],Church-run schools [35],31,,,,"Buddhist and Catholic churches ran nursery schools attended by Japanese American children, as did neighborhood Protestant churches. In Seattle, the Maryknoll Catholic school was a prominent institution in the community.",2014-02-18T17:06:20-0800,2014-02-18T17:06:20-0800
36,Race and racism [36],Race and racism,0,,,,,2014-02-18T17:06:20-0800,2014-02-18T17:06:20-0800
37,Discrimination [37],Discrimination,36,,,,,2014-02-18T17:06:20-0800,2014-02-18T17:06:20-0800
38,Cross-racial relations [38],Cross-racial relations,36,,,,,2014-02-18T17:06:20-0800,2014-02-18T17:06:20-0800
40,Arts and literature [40],Arts and literature,0,,,,,2014-02-18T17:06:20-0800,2014-02-18T17:06:20-0800
42,Identity and values [42],Identity and values,0,,,,"Like millions of other immigrants in the United States, first-generation Japanese and their children felt the tension of maintaining their cultural heritage amid pressures to conform to mainstream society while also dealing with discrimination. Although most new immigrants in this country have had to struggle with these same conflicts, one traumatic event sets Japanese Americans apart from other immigrant groups: the mass incarceration during World War II.",2014-02-18T17:06:20-0800,2014-02-18T17:06:20-0800
43,Issei [43],Issei,42,,,,"The earliest wave of Japanese immigrants, the Issei (first generation), had a strong sense of their ethnic identity and retained the values and traditions of their country of birth. Most came to the United States as sojourners and planned to return to Japan after earning their fortunes. In addition, discriminatory laws forbade them from becoming American citizens and from exercising other basic rights, such as owning or leasing land. Since they were thus prevented from fully taking part in American life, it is not surprising that many still identified strongly with the culture of their homeland.",2014-02-18T17:06:20-0800,2014-02-18T17:06:20-0800
44,Nisei [44],Nisei,42,,,,"The Nisei (second generation) felt the pull of two cultures. American born, attending public schools, and influenced by American popular culture, they shared the same idols, favorite songs and sports heroes as most other children of their generation. Wanting to fit in, many Nisei with Japanese first names dropped them for Western ones that their non-Japanese friends could easily pronounce. Yet, most grew up in Japanese neighborhoods, and their parents taught them the customs and values of the old country.",2014-02-18T17:06:20-0800,2014-02-18T17:06:20-0800
45,Kibei [45],Kibei,42,,,,"Kibei is the term for the generation of Nisei born in the U.S. but sent to Japan for education. When in Japan, the Kibei lived with grandparents or other relatives while their parents remained in the U.S. to work. Kibei often struggled to fit in both in Japan, where they were viewed as outsiders, and the U.S., where they were considered ""too Japanese"" by their Nisei peers. Because of their knowledge of both cultures and languages, the Kibei in particular were targeted by the government as ""disloyal"" during World War II. Ironically, the Kibei were heavily recruited for the Military Intelligence Service because of their linguistic abilities.",2014-02-18T17:06:20-0800,2014-02-18T17:06:20-0800
46,Family [46],Family,42,,,,,2014-02-18T17:06:20-0800,2014-02-18T17:06:20-0800
47,Japanese American identity [47],Japanese American identity,42,,,,,2014-02-18T17:06:20-0800,2014-02-18T17:06:20-0800
48,Pearl Harbor and aftermath [48],Pearl Harbor and aftermath,399,,,,"The bombing of Pearl Harbor on December 7, 1941, stunned the Japanese American community as much as the rest of the country. Many Issei (first generation) had been receiving news from their families in Japan and were aware of the growing tension between the two countries, but few thought that Japan would provoke the United States into war. Japanese Americans would again be shocked when immediately following the bombing, the FBI began going door to door making arrests. Any issei who was at all prominent was considered a potential spy, including Japanese association officers, language-school principals, and Buddhist priests. Without any meaningful due process, these men -- mostly heads of families -- were summarily separated from their wives and children and incarcerated.",2014-02-18T17:06:20-0800,2014-02-18T17:06:20-0800
49,Events prior to Pearl Harbor [49],Events prior to Pearl Harbor,48,,,,"Before the bombing of Pearl Harbor on December 7, 1941, many in the Japanese American community were aware of the growing tension between Japan and the United States. Some had been receiving news from their families overseas, while others had visited Japan and witnessed the growing militarization there. However, few thought that Japan would provoke the much larger United States into war.",2014-02-18T17:06:20-0800,2014-02-18T17:06:20-0800
50,"Arrests, searches, and seizures [50]","Arrest, searches, and seizures",48,,,,"Many Nisei (second-generation Japanese Americans) can vividly recall their fathers being hauled off by FBI agents to unidentified destinations for an unknown duration. Not surprisingly, anxiety and uncertainty spread quickly after Pearl Harbor. Many precious heirlooms were burned by families wanting to rid themselves of any connection to Japan. FBI agents raided Japanese American homes, confiscating short wave radios, cameras, and books. With the systematic removal of Issei (first-generation) leaders, the Nisei -- children and teenagers for the most part -- were abruptly asked to represent the larger group as well as their own families. They found themselves translating FBI and military orders for their parents and helping to keep family businesses going.",2014-02-18T17:06:20-0800,2014-02-18T17:06:20-0800
51,Personal recollections [51],Personal recollections,48,,,,,2014-02-18T17:06:20-0800,2014-02-18T17:06:20-0800
52,Japanese American community responses [52],Japanese American community responses,57,,,,,2014-02-18T17:06:20-0800,2014-02-18T17:06:20-0800
